"text","favorited","favoriteCount","replyToSN","created","truncated","replyToSID","id","replyToUID","statusSource","screenName","retweetCount","isRetweet","retweeted","longitude","latitude","yr","mo"
"We now have the highest incarceration rate in the entire world with over 2 million in prison and millions more on probation or parole.",FALSE,1831,NA,2015-12-20 20:29:07,FALSE,NA,"678673505609584640",NA,"<a href=""https://about.twitter.com/products/tweetdeck"" rel=""nofollow"">TweetDeck</a>","BernieSanders",977,FALSE,FALSE,NA,NA,2015,12
"Post-debate breakfast from this morning at IHOP in Bedford, New Hampshire. #fitn https://t.co/ei21zp0NBM",FALSE,5150,NA,2015-12-20 19:26:22,FALSE,NA,"678657713174368257",NA,"<a href=""http://twitter.com"" rel=""nofollow"">Twitter Web Client</a>","BernieSanders",993,FALSE,FALSE,NA,NA,2015,12
"""Get in on the love train. That’s what Bernie Sanders’ campaign is.” - @CornelWest 
https://t.co/AboTJCghY1",FALSE,1102,NA,2015-12-20 19:11:00,FALSE,NA,"678653846000828416",NA,"<a href=""https://about.twitter.com/products/tweetdeck"" rel=""nofollow"">TweetDeck</a>","BernieSanders",480,FALSE,FALSE,NA,NA,2015,12
"""Bernie Sanders Scores Big Win; Breaks Major Fundraising Record""
https://t.co/NEZQFzeYw7",FALSE,1581,NA,2015-12-20 19:10:00,FALSE,NA,"678653594061561856",NA,"<a href=""https://about.twitter.com/products/tweetdeck"" rel=""nofollow"">TweetDeck</a>","BernieSanders",679,FALSE,FALSE,NA,NA,2015,12
"Corporate greed is rampant, and the very rich keep growing richer while everyone else grows poorer.",FALSE,2231,NA,2015-12-20 17:16:03,FALSE,NA,"678624920402718721",NA,"<a href=""https://about.twitter.com/products/tweetdeck"" rel=""nofollow"">TweetDeck</a>","BernieSanders",1063,FALSE,FALSE,NA,NA,2015,12
"This campaign will be driven by issues and serious debate.
https://t.co/MtLAoHk0AS",FALSE,1215,NA,2015-12-20 16:42:48,FALSE,NA,"678616551793168384",NA,"<a href=""https://about.twitter.com/products/tweetdeck"" rel=""nofollow"">TweetDeck</a>","BernieSanders",404,FALSE,FALSE,NA,NA,2015,12
"The United States once led the world in terms of the percentage of our young people who had college degrees. Today we’re now in 12th place.",FALSE,3812,NA,2015-12-20 15:19:03,FALSE,NA,"678595475478413312",NA,"<a href=""https://about.twitter.com/products/tweetdeck"" rel=""nofollow"">TweetDeck</a>","BernieSanders",1810,FALSE,FALSE,NA,NA,2015,12
"I got into politics not to figure out how to become President. I got into politics because I give a damn. #DemDebate https://t.co/7yFxGXyKB7",FALSE,22215,NA,2015-12-20 03:52:02,FALSE,NA,"678422580462821376",NA,"<a href=""http://twitter.com"" rel=""nofollow"">Twitter Web Client</a>","BernieSanders",11713,FALSE,FALSE,NA,NA,2015,12
"Addiction is a disease, not a criminal activity. 
#DemDebate https://t.co/HdoBtSHq1t",FALSE,8260,NA,2015-12-20 03:31:40,FALSE,NA,"678417454566137856",NA,"<a href=""https://about.twitter.com/products/tweetdeck"" rel=""nofollow"">TweetDeck</a>","BernieSanders",4217,FALSE,FALSE,NA,NA,2015,12
"Addiction is ravaging families and communities in NH. This is a crisis, and we need to treat it as a health issue—not throw people in jail.",FALSE,3783,NA,2015-12-20 03:23:45,FALSE,NA,"678415462703702016",NA,"<a href=""http://twitter.com"" rel=""nofollow"">Twitter Web Client</a>","BernieSanders",1768,FALSE,FALSE,NA,NA,2015,12
"I know you have heard these names before but they bear repeating so we do not lose sight of the real human price being paid. #DemDebate",FALSE,3819,"BernieSanders",2015-12-20 03:22:26,FALSE,"678415033966141440","678415133618642944","216776631","<a href=""http://twitter.com"" rel=""nofollow"">Twitter Web Client</a>","BernieSanders",1966,FALSE,FALSE,NA,NA,2015,12
"Michael Brown, Eric Garner, Jessica Hernandez, Freddie Gray, Sandra Bland, Tamir Rice, Samuel Dubose, Rekia Boyd and too many more.",FALSE,5136,NA,2015-12-20 03:22:03,FALSE,NA,"678415033966141440",NA,"<a href=""http://twitter.com"" rel=""nofollow"">Twitter Web Client</a>","BernieSanders",3260,FALSE,FALSE,NA,NA,2015,12
"Any serious criminal justice reform must include removing marijuana from the Controlled Substances Act. #DemDebate",FALSE,4887,NA,2015-12-20 03:21:11,FALSE,NA,"678414815623270400",NA,"<a href=""http://twitter.com"" rel=""nofollow"">Twitter Web Client</a>","BernieSanders",3044,FALSE,FALSE,NA,NA,2015,12
"We need to rethink the ""War on Drugs"" and treat substance abuse as a serious health issue, not a criminal issue. #DebateWithBernie",FALSE,5335,NA,2015-12-20 03:20:29,FALSE,NA,"678414639651270656",NA,"<a href=""http://twitter.com"" rel=""nofollow"">Twitter Web Client</a>","BernieSanders",3487,FALSE,FALSE,NA,NA,2015,12
"We need to rethink the ""War on Drugs"" and treat substance abuse as a serious health issue, not a criminal issue. #DebateWithBernie",FALSE,5335,NA,2015-12-20 03:20:29,FALSE,NA,"678414639651270656",NA,"<a href=""http://twitter.com"" rel=""nofollow"">Twitter Web Client</a>","BernieSanders",3487,FALSE,FALSE,NA,NA,2015,12
"'Socialist' programs from FDR and LBJ:
✅Social Security
✅Minimum Wage
✅Medicare and Medicaid
✅40-hour work week
#DemDebate",FALSE,7628,NA,2015-12-20 03:10:04,FALSE,NA,"678412020530683904",NA,"<a href=""http://twitter.com"" rel=""nofollow"">Twitter Web Client</a>","BernieSanders",4615,FALSE,FALSE,NA,NA,2015,12
"When a husband can’t get time off to care for his cancer-stricken wife, that is not a family value. #DemDebate
https://t.co/fhao0WkwN8",FALSE,3760,NA,2015-12-20 03:08:10,FALSE,NA,"678411540123512833",NA,"<a href=""https://about.twitter.com/products/tweetdeck"" rel=""nofollow"">TweetDeck</a>","BernieSanders",1775,FALSE,FALSE,NA,NA,2015,12
"Medicare for All would eliminate payments to insurance companies that put profits before people. #DebateWithBernie",FALSE,2614,NA,2015-12-20 03:05:08,FALSE,NA,"678410778203000832",NA,"<a href=""http://twitter.com"" rel=""nofollow"">Twitter Web Client</a>","BernieSanders",1443,FALSE,FALSE,NA,NA,2015,12
"Bernie’s college plan is the only plan that affords lower-income kids the same opportunity for a quality education. #DebateWithBernie",FALSE,3298,NA,2015-12-20 03:02:52,FALSE,NA,"678410208884989952",NA,"<a href=""http://twitter.com"" rel=""nofollow"">Twitter Web Client</a>","BernieSanders",1675,FALSE,FALSE,NA,NA,2015,12
"CEO's of large multinationals may like @HillaryClinton, but they ain't gonna like me. #DemDebate
https://t.co/dPIBsCXH9J",FALSE,4119,NA,2015-12-20 03:02:10,FALSE,NA,"678410030295552000",NA,"<a href=""http://twitter.com"" rel=""nofollow"">Twitter Web Client</a>","BernieSanders",2606,FALSE,FALSE,NA,NA,2015,12
"We need debt-free college and free tuition is the best way to get there. #DebateWithBernie",FALSE,3708,NA,2015-12-20 03:00:59,FALSE,NA,"678409732533678080",NA,"<a href=""http://twitter.com"" rel=""nofollow"">Twitter Web Client</a>","BernieSanders",2174,FALSE,FALSE,NA,NA,2015,12
"I don’t think it’s a radical idea that in the richest country in the history of the world health care should be a right, not a privilege.",FALSE,7131,NA,2015-12-20 02:57:39,FALSE,NA,"678408894637547521",NA,"<a href=""https://about.twitter.com/products/tweetdeck"" rel=""nofollow"">TweetDeck</a>","BernieSanders",3823,FALSE,FALSE,NA,NA,2015,12
"Bernie helped lead the effort against @billclinton who thought it would be a great idea to deregulate Wall Street. #DebateWithBernie",FALSE,2108,NA,2015-12-20 02:52:27,FALSE,NA,"678407585339449344",NA,"<a href=""http://twitter.com"" rel=""nofollow"">Twitter Web Client</a>","BernieSanders",1228,FALSE,FALSE,NA,NA,2015,12
"""The greed of the billionaire class, the greed of Wall Street is destroying this economy.”#DebateWithBernie",FALSE,2301,NA,2015-12-20 02:47:40,FALSE,NA,"678406384128495616",NA,"<a href=""https://about.twitter.com/products/tweetdeck"" rel=""nofollow"">TweetDeck</a>","BernieSanders",1361,FALSE,FALSE,NA,NA,2015,12
"We do not have a super PAC. We do not want the money of corporate America. This is a people’s campaign. #DebateWithBernie",FALSE,2980,NA,2015-12-20 02:46:17,FALSE,NA,"678406035602857984",NA,"<a href=""http://twitter.com"" rel=""nofollow"">Twitter Web Client</a>","BernieSanders",1643,FALSE,FALSE,NA,NA,2015,12
"You can’t take on Wall Street banks and billionaires by taking their money. #DebateWithBernie",FALSE,3015,NA,2015-12-20 02:43:50,FALSE,NA,"678405416326438913",NA,"<a href=""http://twitter.com"" rel=""nofollow"">Twitter Web Client</a>","BernieSanders",1833,FALSE,FALSE,NA,NA,2015,12
"A $1 trillion investment in infrastructure could create 13 million decent paying jobs. Invest in infrastructure, not more war. #DemDebate",FALSE,3707,NA,2015-12-20 02:38:52,FALSE,NA,"678404166713217025",NA,"<a href=""https://about.twitter.com/products/tweetdeck"" rel=""nofollow"">TweetDeck</a>","BernieSanders",2472,FALSE,FALSE,NA,NA,2015,12
"Equal pay for equal work. It’s not a radical idea. #DebateWithBernie",FALSE,3928,NA,2015-12-20 02:38:09,FALSE,NA,"678403986718859265",NA,"<a href=""https://about.twitter.com/products/tweetdeck"" rel=""nofollow"">TweetDeck</a>","BernieSanders",2405,FALSE,FALSE,NA,NA,2015,12
"""I worry that @HillaryClinton is too much into regime change and too aggressive without knowing what the unintended consequences might be.""",FALSE,3078,NA,2015-12-20 02:26:15,FALSE,NA,"678400991591550976",NA,"<a href=""http://twitter.com"" rel=""nofollow"">Twitter Web Client</a>","BernieSanders",1346,FALSE,FALSE,NA,NA,2015,12
"Bernie supports a defense budget that secures our national security interests not the profits of defense contractors. #DemDebate",FALSE,2339,NA,2015-12-20 02:18:50,FALSE,NA,"678399125361180674",NA,"<a href=""http://twitter.com"" rel=""nofollow"">Twitter Web Client</a>","BernieSanders",1252,FALSE,FALSE,NA,NA,2015,12
"""I listened to what Bush and Cheney had to say about Iraq. I listened carefully, and I didn't believe them so I voted against the war.""",FALSE,2890,NA,2015-12-20 02:16:23,FALSE,NA,"678398511910637568",NA,"<a href=""http://twitter.com"" rel=""nofollow"">Twitter Web Client</a>","BernieSanders",1225,FALSE,FALSE,NA,NA,2015,12
"Qatar will spend $200 billion on the 2022 World Cup – $200 billion a soccer event, yet very little to fight against ISIS. #DemDebate",FALSE,4246,NA,2015-12-20 02:14:34,FALSE,NA,"678398053028642817",NA,"<a href=""http://twitter.com"" rel=""nofollow"">Twitter Web Client</a>","BernieSanders",3065,FALSE,FALSE,NA,NA,2015,12
"""I voted against the war in Iraq. That was the right vote. We must be vigorous in combatting terrorism, but we can’t do it alone.""",FALSE,2309,NA,2015-12-20 02:13:07,FALSE,NA,"678397687272742913",NA,"<a href=""http://twitter.com"" rel=""nofollow"">Twitter Web Client</a>","BernieSanders",844,FALSE,FALSE,NA,NA,2015,12
"We will not turn our backs on the refugees who are fleeing Syria and Afghanistan. #DemDebate",FALSE,3224,NA,2015-12-20 02:10:13,FALSE,NA,"678396956927008769",NA,"<a href=""http://twitter.com"" rel=""nofollow"">Twitter Web Client</a>","BernieSanders",1610,FALSE,FALSE,NA,NA,2015,12
"“Trump thinks lower wages are a good idea. I believe we must stand together. We can not be divided by race or religion.” #DebateWithBernie",FALSE,3301,NA,2015-12-20 02:03:39,FALSE,NA,"678395305214234624",NA,"<a href=""https://about.twitter.com/products/tweetdeck"" rel=""nofollow"">TweetDeck</a>","BernieSanders",1790,FALSE,FALSE,NA,NA,2015,12
"Bernie Sanders' gun record (1994) https://t.co/mr699UFYM6",FALSE,3542,NA,2015-12-20 01:59:52,FALSE,NA,"678394353744748544",NA,"<a href=""http://twitter.com"" rel=""nofollow"">Twitter Web Client</a>","BernieSanders",1771,FALSE,FALSE,NA,NA,2015,12
"It's time to strengthen gun safety laws:
✅Universal background checks
✅Assault weapon ban
✅Stricter gun trafficking laws
#DebateWithBernie",FALSE,4119,NA,2015-12-20 01:53:21,FALSE,NA,"678392713125961729",NA,"<a href=""http://twitter.com"" rel=""nofollow"">Twitter Web Client</a>","BernieSanders",2026,FALSE,FALSE,NA,NA,2015,12
"There’s only one candidate on stage who voted against (and led the opposition to) the Iraq War. #DebateWithBernie",FALSE,2986,NA,2015-12-20 01:49:44,FALSE,NA,"678391801586319360",NA,"<a href=""https://about.twitter.com/products/tweetdeck"" rel=""nofollow"">TweetDeck</a>","BernieSanders",1719,FALSE,FALSE,NA,NA,2015,12
"✅America’s 20 wealthiest people now own more wealth than the bottom half of the American population combined.",FALSE,2182,"BernieSanders",2015-12-20 01:44:34,FALSE,"678390335429570560","678390501138149377","216776631","<a href=""http://twitter.com"" rel=""nofollow"">Twitter Web Client</a>","BernieSanders",1312,FALSE,FALSE,NA,NA,2015,12
"Let’s talk about data that matters to working families:
✅47 million are living in poverty
✅51% of African-American youth are unemployed",FALSE,2596,NA,2015-12-20 01:43:54,FALSE,NA,"678390335429570560",NA,"<a href=""http://twitter.com"" rel=""nofollow"">Twitter Web Client</a>","BernieSanders",1464,FALSE,FALSE,NA,NA,2015,12
"I am running for president because it is too late for establishment politics and economics. #DebateWithBernie",FALSE,3021,NA,2015-12-20 01:37:07,FALSE,NA,"678388628603715584",NA,"<a href=""https://about.twitter.com/products/tweetdeck"" rel=""nofollow"">TweetDeck</a>","BernieSanders",1540,FALSE,FALSE,NA,NA,2015,12
"Change never takes place from the top down. It always takes place from the bottom up. Join us. #DebateWithBernie https://t.co/UEhthJrZM3",FALSE,3056,NA,2015-12-20 01:24:06,FALSE,NA,"678385353758142466",NA,"<a href=""https://about.twitter.com/products/tweetdeck"" rel=""nofollow"">TweetDeck</a>","BernieSanders",1648,FALSE,FALSE,NA,NA,2015,12
"Most new wealth flows to the top 1 percent. It's a system held in place by corrupt politics. #DemDebate
https://t.co/84NZnfCgWh",FALSE,1674,NA,2015-12-20 00:38:01,FALSE,NA,"678373753659637761",NA,"<a href=""http://twitter.com"" rel=""nofollow"">Twitter Web Client</a>","BernieSanders",1076,FALSE,FALSE,NA,NA,2015,12
"Make sure to add Bernie.sanders on @Snapchat for updates throughout the #DemDebate! https://t.co/QEZS8mFik3",FALSE,1606,NA,2015-12-19 22:28:20,FALSE,NA,"678341118354919424",NA,"<a href=""https://about.twitter.com/products/tweetdeck"" rel=""nofollow"">TweetDeck</a>","BernieSanders",1054,FALSE,FALSE,NA,NA,2015,12
"Over two million contributions have been made to the only campaign that rejects a corrupt campaign finance system.
https://t.co/zwKvdAyFZz",FALSE,1820,NA,2015-12-19 21:46:55,FALSE,NA,"678330696713166848",NA,"<a href=""http://twitter.com"" rel=""nofollow"">Twitter Web Client</a>","BernieSanders",1024,FALSE,FALSE,NA,NA,2015,12
"This campaign isn't just about electing Bernie Sanders. It's about the needs of the American people &amp; the ideas to address those needs.",FALSE,3987,NA,2015-12-19 20:02:06,FALSE,NA,"678304319142158336",NA,"<a href=""https://about.twitter.com/products/tweetdeck"" rel=""nofollow"">TweetDeck</a>","BernieSanders",1552,FALSE,FALSE,NA,NA,2015,12
"We can deliver change, but we can’t do it by tinkering with the system at the margins. We need a political revolution.",FALSE,2703,NA,2015-12-19 18:12:21,FALSE,NA,"678276700355039232",NA,"<a href=""https://about.twitter.com/products/tweetdeck"" rel=""nofollow"">TweetDeck</a>","BernieSanders",1268,FALSE,FALSE,NA,NA,2015,12
"Senator @NinaTurner is kicking off a day of canvassing in Manchester, New Hampshire. #FITN
https://t.co/nIMpJiOKI6 https://t.co/U5AR8Kisg0",FALSE,1182,NA,2015-12-19 16:06:49,FALSE,NA,"678245105992605700",NA,"<a href=""https://about.twitter.com/products/tweetdeck"" rel=""nofollow"">TweetDeck</a>","BernieSanders",413,FALSE,FALSE,NA,NA,2015,12
"I've said it since day one: I can't do it alone. Join the conversation: #DebateWithBernie.

https://t.co/Ye7VLtkInS https://t.co/xqet1lifyf",FALSE,4020,NA,2015-12-19 15:06:53,FALSE,NA,"678230026505084928",NA,"<a href=""http://twitter.com"" rel=""nofollow"">Twitter Web Client</a>","BernieSanders",2396,FALSE,FALSE,NA,NA,2015,12
"You are the power behind this campaign and we are doing something unprecedented. Sign our petition to the DNC:
https://t.co/sBUKGL8lQl",FALSE,3365,NA,2015-12-19 01:51:03,FALSE,NA,"678029748337926144",NA,"<a href=""https://about.twitter.com/products/tweetdeck"" rel=""nofollow"">TweetDeck</a>","BernieSanders",1885,FALSE,FALSE,NA,NA,2015,12
"“The leadership of the DNC is now actively attempting to undermine our campaign.” - Jeff Weaver, Campaign Manager
https://t.co/W1cyoifZyP",FALSE,2788,NA,2015-12-19 00:09:58,FALSE,NA,"678004310312136704",NA,"<a href=""https://about.twitter.com/products/tweetdeck"" rel=""nofollow"">TweetDeck</a>","BernieSanders",1962,FALSE,FALSE,NA,NA,2015,12
"Sign our petition telling the DNC that you expect a level playing field in this primary campaign. This is important.
https://t.co/sBUKGKQKYN",FALSE,4707,NA,2015-12-18 21:43:35,FALSE,NA,"677967469735202817",NA,"<a href=""http://twitter.com"" rel=""nofollow"">Twitter Web Client</a>","BernieSanders",3799,FALSE,FALSE,NA,NA,2015,12
"Some people say my economic ideas are radical. You should hear what the Pope is saying.",FALSE,4780,NA,2015-12-18 16:27:03,FALSE,NA,"677887812817973249",NA,"<a href=""https://about.twitter.com/products/tweetdeck"" rel=""nofollow"">TweetDeck</a>","BernieSanders",1748,FALSE,FALSE,NA,NA,2015,12
"The U.S. Postal Service is one of our most popular and important government agencies. Let’s protect the Postal Service, not dismantle it.",FALSE,3631,NA,2015-12-18 15:01:05,FALSE,NA,"677866179260641281",NA,"<a href=""https://about.twitter.com/products/tweetdeck"" rel=""nofollow"">TweetDeck</a>","BernieSanders",1055,FALSE,FALSE,NA,NA,2015,12
"Meanwhile, as tens of millions of Americans struggle to survive economically, the wealthiest people are doing phenomenally well.",FALSE,3447,NA,2015-12-18 13:46:03,FALSE,NA,"677847293907755008",NA,"<a href=""https://about.twitter.com/products/tweetdeck"" rel=""nofollow"">TweetDeck</a>","BernieSanders",1482,FALSE,FALSE,NA,NA,2015,12
"Clearly, if we are going to save the middle class and protect our planet, we need to change the political dynamics of the nation.",FALSE,4241,NA,2015-12-18 02:51:06,FALSE,NA,"677682470041444352",NA,"<a href=""https://about.twitter.com/products/tweetdeck"" rel=""nofollow"">TweetDeck</a>","BernieSanders",1589,FALSE,FALSE,NA,NA,2015,12
"A nation will not survive morally or economically when so few have so much, while so many have so little.",FALSE,3925,NA,2015-12-18 01:46:06,FALSE,NA,"677666112088051712",NA,"<a href=""https://about.twitter.com/products/tweetdeck"" rel=""nofollow"">TweetDeck</a>","BernieSanders",2296,FALSE,FALSE,NA,NA,2015,12
"I'm on the phone now with @GeorgeLopez. Click here to listen in --&gt; https://t.co/V8QQLiOLuo #UnidosConBernie https://t.co/ez14WdzuCQ",FALSE,1827,NA,2015-12-18 01:11:12,FALSE,NA,"677657329203023872",NA,"<a href=""http://twitter.com"" rel=""nofollow"">Twitter Web Client</a>","BernieSanders",499,FALSE,FALSE,NA,NA,2015,12
"We can live in a country where all of our qualified young people, regardless of income, can go to college. #Bernie2016",FALSE,4272,NA,2015-12-18 00:11:02,FALSE,NA,"677642188197466112",NA,"<a href=""https://about.twitter.com/products/tweetdeck"" rel=""nofollow"">TweetDeck</a>","BernieSanders",2140,FALSE,FALSE,NA,NA,2015,12
"Nothing significant happens in terms of social change unless a strong grassroots movement takes place. Join us: https://t.co/UZZgeMU7sl",FALSE,1060,NA,2015-12-17 22:24:07,FALSE,NA,"677615281896689664",NA,"<a href=""https://about.twitter.com/products/tweetdeck"" rel=""nofollow"">TweetDeck</a>","BernieSanders",460,FALSE,FALSE,NA,NA,2015,12
"Join @GeorgeLopez and I tonight for a tele-town hall at 7 pm CT/8 PM ET. RSVP to listen in --&gt; https://t.co/V8QQLiOLuo #UnidosConBernie",FALSE,944,NA,2015-12-17 21:44:52,FALSE,NA,"677605406324236288",NA,"<a href=""http://twitter.com"" rel=""nofollow"">Twitter Web Client</a>","BernieSanders",397,FALSE,FALSE,NA,NA,2015,12
"This country faces more serious problems today than at any time in modern history, and establishment politics will not resolve them.",FALSE,2094,NA,2015-12-17 20:48:07,FALSE,NA,"677591122646974464",NA,"<a href=""https://about.twitter.com/products/tweetdeck"" rel=""nofollow"">TweetDeck</a>","BernieSanders",949,FALSE,FALSE,NA,NA,2015,12
"This campaign is making a little bit of history. I hope very much that you will become part of our team.
https://t.co/6UFBFSG2o9",FALSE,2933,NA,2015-12-17 19:55:44,FALSE,NA,"677577938607280128",NA,"<a href=""http://twitter.com"" rel=""nofollow"">Twitter Web Client</a>","BernieSanders",1805,FALSE,FALSE,NA,NA,2015,12
"Democracy Daily is an online space where people can come to learn more about the issues behind our movement.
https://t.co/ebJM9pCcp1",FALSE,640,NA,2015-12-17 19:31:04,FALSE,NA,"677571732509626369",NA,"<a href=""https://about.twitter.com/products/tweetdeck"" rel=""nofollow"">TweetDeck</a>","BernieSanders",288,FALSE,FALSE,NA,NA,2015,12
"I’m proud to have Democracy for America and its one-million members join our people powered campaign.",FALSE,2771,NA,2015-12-17 17:57:50,FALSE,NA,"677548268222619648",NA,"<a href=""https://about.twitter.com/products/tweetdeck"" rel=""nofollow"">TweetDeck</a>","BernieSanders",787,FALSE,FALSE,NA,NA,2015,12
"For decades, @CWAUnion has been fighting for the rights of working families and I’m so proud today to be with you in that fight.",FALSE,1021,"BernieSanders",2015-12-17 16:57:41,FALSE,"677533043683434496","677533132841701376","216776631","<a href=""https://about.twitter.com/products/tweetdeck"" rel=""nofollow"">TweetDeck</a>","BernieSanders",341,FALSE,FALSE,NA,NA,2015,12
"Brothers and sisters, let me thank the 700,000 members of the Communications Workers of America for their support.
https://t.co/Zqgvxfc1Eo",FALSE,1779,NA,2015-12-17 16:57:20,FALSE,NA,"677533043683434496",NA,"<a href=""https://about.twitter.com/products/tweetdeck"" rel=""nofollow"">TweetDeck</a>","BernieSanders",694,FALSE,FALSE,NA,NA,2015,12
"I stand with United flight attendants as 24,000 demonstrate at every airport for a fair contract. https://t.co/a6VGcndlik",FALSE,3224,NA,2015-12-17 16:54:07,FALSE,NA,"677532237257158656",NA,"<a href=""https://about.twitter.com/products/tweetdeck"" rel=""nofollow"">TweetDeck</a>","BernieSanders",1095,FALSE,FALSE,NA,NA,2015,12
"Since the Wall Street crash of 2008, more than 58% of all new income has gone to the top 1%. America needs a political revolution.",FALSE,2781,NA,2015-12-17 15:24:07,FALSE,NA,"677509585129705472",NA,"<a href=""https://about.twitter.com/products/tweetdeck"" rel=""nofollow"">TweetDeck</a>","BernieSanders",1408,FALSE,FALSE,NA,NA,2015,12
"Over two million contributions have been made to the only campaign that rejects a corrupt campaign finance system.
https://t.co/avmYgOKaQz",FALSE,1990,NA,2015-12-17 14:03:08,FALSE,NA,"677489205304360960",NA,"<a href=""http://twitter.com"" rel=""nofollow"">Twitter Web Client</a>","BernieSanders",1038,FALSE,FALSE,NA,NA,2015,12
"We must end the scandal in which millions of American employees work 50 or 60 hours a week and earn no overtime.",FALSE,3487,NA,2015-12-17 13:16:17,FALSE,NA,"677477415988391937",NA,"<a href=""https://about.twitter.com/products/tweetdeck"" rel=""nofollow"">TweetDeck</a>","BernieSanders",1351,FALSE,FALSE,NA,NA,2015,12
"The skyrocketing level of income and wealth inequality is not only grotesque and immoral, it is economically unsustainable.",FALSE,2827,NA,2015-12-17 02:00:43,FALSE,NA,"677307403126329344",NA,"<a href=""https://about.twitter.com/products/tweetdeck"" rel=""nofollow"">TweetDeck</a>","BernieSanders",1364,FALSE,FALSE,NA,NA,2015,12
"Sheldon Adelson is spending unbelievable sums of money, not just on elections, but for control of our media too. https://t.co/nOLlK3pcPY",FALSE,1415,NA,2015-12-17 01:00:36,FALSE,NA,"677292273512685568",NA,"<a href=""http://twitter.com"" rel=""nofollow"">Twitter Web Client</a>","BernieSanders",1193,FALSE,FALSE,NA,NA,2015,12
"We are counting on each and every one of you to pass this historic deadline of 2 million contributions tonight.
https://t.co/S9wySpm67c",FALSE,1147,NA,2015-12-17 00:15:34,FALSE,NA,"677280940729761794",NA,"<a href=""https://about.twitter.com/products/tweetdeck"" rel=""nofollow"">TweetDeck</a>","BernieSanders",531,FALSE,FALSE,NA,NA,2015,12
"My Iowa staff is doing a @reddit_AMA on Saturday! Stay tuned for details.",FALSE,1529,NA,2015-12-16 23:16:47,FALSE,NA,"677266149390860288",NA,"<a href=""https://about.twitter.com/products/tweetdeck"" rel=""nofollow"">TweetDeck</a>","BernieSanders",496,FALSE,FALSE,NA,NA,2015,12
"The Fed should act with the same sense of urgency to rebuild the disappearing middle class as it did to bail out Wall Street banks.",FALSE,2166,NA,2015-12-16 22:49:05,FALSE,NA,"677259177337589761",NA,"<a href=""https://about.twitter.com/products/tweetdeck"" rel=""nofollow"">TweetDeck</a>","BernieSanders",970,FALSE,FALSE,NA,NA,2015,12
"Thank you to all of the volunteers who filed today to get me on the ballot in Ohio. #OhioForBernie https://t.co/DyiKk8FVSV",FALSE,3636,NA,2015-12-16 22:40:53,FALSE,NA,"677257113530318848",NA,"<a href=""http://twitter.com"" rel=""nofollow"">Twitter Web Client</a>","BernieSanders",1034,FALSE,FALSE,NA,NA,2015,12
"I am calling on all of us in public life, including my fellow candidates for president, and all Americans to condemn anti-Muslim hatred.",FALSE,5795,NA,2015-12-16 20:55:25,FALSE,NA,"677230573090418689",NA,"<a href=""https://about.twitter.com/products/tweetdeck"" rel=""nofollow"">TweetDeck</a>","BernieSanders",2968,FALSE,FALSE,NA,NA,2015,12
"If we stand for anything, we have got to stand together to end all forms of racism.
https://t.co/lwjisIOY91",FALSE,2637,NA,2015-12-16 20:25:38,FALSE,NA,"677223079404158976",NA,"<a href=""http://twitter.com"" rel=""nofollow"">Twitter Web Client</a>","BernieSanders",1517,FALSE,FALSE,NA,NA,2015,12
