"text","favorited","favoriteCount","replyToSN","created","truncated","replyToSID","id","replyToUID","statusSource","screenName","retweetCount","isRetweet","retweeted","longitude","latitude","yr","mo"
"We need a path to citizenship to bring 11 million people out of the shadows. And, that must happen sooner, rather than later.",FALSE,1913,NA,2015-11-12 14:28:02,FALSE,NA,"664811897414221824",NA,"<a href=""https://about.twitter.com/products/tweetdeck"" rel=""nofollow"">TweetDeck</a>","BernieSanders",667,FALSE,FALSE,NA,NA,2015,11
"I'm listening to the #BlackOnCampus conversation. It's time to address structural racism on college campuses.",FALSE,9555,NA,2015-11-12 02:01:33,FALSE,NA,"664624038673805312",NA,"<a href=""http://twitter.com/download/iphone"" rel=""nofollow"">Twitter for iPhone</a>","BernieSanders",6504,FALSE,FALSE,NA,NA,2015,11
"It’s not just income and wealth inequality. It’s not just corporate control over the media. The real issue is: Who's gonna stand up to them?",FALSE,2038,NA,2015-11-12 01:38:02,FALSE,NA,"664618120200388609",NA,"<a href=""https://about.twitter.com/products/tweetdeck"" rel=""nofollow"">TweetDeck</a>","BernieSanders",976,FALSE,FALSE,NA,NA,2015,11
"""When the peace treaty is signed, the war isn't over for the veterans, or the family. It's just starting."" - Karl Marlantes",FALSE,1328,NA,2015-11-12 00:04:03,FALSE,NA,"664594470227218432",NA,"<a href=""https://about.twitter.com/products/tweetdeck"" rel=""nofollow"">TweetDeck</a>","BernieSanders",510,FALSE,FALSE,NA,NA,2015,11
"Glad to see so many young people here today. It’s important to understand the sacrifices veterans have made. #FITN https://t.co/v0KuRrrr60",FALSE,1687,NA,2015-11-11 21:55:41,FALSE,NA,"664562164682723328",NA,"<a href=""https://about.twitter.com/products/tweetdeck"" rel=""nofollow"">TweetDeck</a>","BernieSanders",418,FALSE,FALSE,NA,NA,2015,11
"As we look back through history, we know women were at the forefront of every progressive victory in this country.",FALSE,2885,NA,2015-11-11 20:32:04,FALSE,NA,"664541121624698881",NA,"<a href=""https://about.twitter.com/products/tweetdeck"" rel=""nofollow"">TweetDeck</a>","BernieSanders",1404,FALSE,FALSE,NA,NA,2015,11
"The cost of war is real, and we have got to support those people who have put their lives on the line defending this country. #VeteransDay",FALSE,2240,NA,2015-11-11 19:14:04,FALSE,NA,"664521491552141312",NA,"<a href=""https://about.twitter.com/products/tweetdeck"" rel=""nofollow"">TweetDeck</a>","BernieSanders",1202,FALSE,FALSE,NA,NA,2015,11
"If patriotism means anything, it means that we do not turn our backs on those who defended us. https://t.co/t13DmwgL6D",FALSE,2261,NA,2015-11-11 18:01:09,FALSE,NA,"664503140125769728",NA,"<a href=""https://about.twitter.com/products/tweetdeck"" rel=""nofollow"">TweetDeck</a>","BernieSanders",1150,FALSE,FALSE,NA,NA,2015,11
"Today we say thank you to all who served. https://t.co/SlRa5kVT4p",FALSE,2429,NA,2015-11-11 16:56:35,FALSE,NA,"664486891371126784",NA,"<a href=""https://about.twitter.com/products/tweetdeck"" rel=""nofollow"">TweetDeck</a>","BernieSanders",876,FALSE,FALSE,NA,NA,2015,11
"Sin trabajadores indocumentados gran parte de nuestro sistema agrario se desplomaría. Ellos son parte del tejido social estadounidense.",FALSE,1148,NA,2015-11-11 16:09:06,FALSE,NA,"664474941589336064",NA,"<a href=""https://about.twitter.com/products/tweetdeck"" rel=""nofollow"">TweetDeck</a>","BernieSanders",596,FALSE,FALSE,NA,NA,2015,11
"If you can't afford to take care of your veterans, then don't go to war. #VeteransDay",FALSE,6234,NA,2015-11-11 14:57:06,FALSE,NA,"664456823940866048",NA,"<a href=""https://about.twitter.com/products/tweetdeck"" rel=""nofollow"">TweetDeck</a>","BernieSanders",4074,FALSE,FALSE,NA,NA,2015,11
"Today, we honor the sacrifice of our nation’s veterans and their families. #VeteransDay https://t.co/0p6jGgS8cy",FALSE,2131,NA,2015-11-11 13:41:03,FALSE,NA,"664437685193322496",NA,"<a href=""https://about.twitter.com/products/tweetdeck"" rel=""nofollow"">TweetDeck</a>","BernieSanders",1379,FALSE,FALSE,NA,NA,2015,11
"Republicans should worry more about their kids and grandchildren and the future of this planet than their campaign contributors. #GOPDebate",FALSE,6650,NA,2015-11-11 04:13:18,FALSE,NA,"664294808207298560",NA,"<a href=""https://about.twitter.com/products/tweetdeck"" rel=""nofollow"">TweetDeck</a>","BernieSanders",3174,FALSE,FALSE,NA,NA,2015,11
"If Teddy Roosevelt were alive today, he would say: break up these too-big-to-fail banks. And he would be right. #GOPDebate",FALSE,3909,NA,2015-11-11 03:54:59,FALSE,NA,"664290195492110336",NA,"<a href=""https://about.twitter.com/products/tweetdeck"" rel=""nofollow"">TweetDeck</a>","BernieSanders",1527,FALSE,FALSE,NA,NA,2015,11
"We already have the biggest military in the world, yet veterans sleep out on the streets. Will Republicans talk about this? #GOPDebate",FALSE,7683,NA,2015-11-11 03:30:34,FALSE,NA,"664284053760274432",NA,"<a href=""https://about.twitter.com/products/tweetdeck"" rel=""nofollow"">TweetDeck</a>","BernieSanders",5184,FALSE,FALSE,NA,NA,2015,11
"Right now, Trump pays the same amount of money into Social Security as someone who makes $118,500 a year. #GOPDebate",FALSE,6154,NA,2015-11-11 02:44:06,FALSE,NA,"664272359075909633",NA,"<a href=""https://about.twitter.com/products/tweetdeck"" rel=""nofollow"">TweetDeck</a>","BernieSanders",4577,FALSE,FALSE,NA,NA,2015,11
"Let us stand today with the tens of millions of workers who are working hard to put food on the table. Let’s #RaiseTheWage. #GOPDebate",FALSE,2811,NA,2015-11-11 02:12:30,FALSE,NA,"664264404196835329",NA,"<a href=""https://about.twitter.com/products/tweetdeck"" rel=""nofollow"">TweetDeck</a>","BernieSanders",1615,FALSE,FALSE,NA,NA,2015,11
"We will close the income inequality gap between the rich and the rest of us.",FALSE,1952,NA,2015-11-11 01:09:05,FALSE,NA,"664248445553606657",NA,"<a href=""https://about.twitter.com/products/tweetdeck"" rel=""nofollow"">TweetDeck</a>","BernieSanders",671,FALSE,FALSE,NA,NA,2015,11
"A job should lift workers out of poverty, not keep them in it. Victor, thanks for standing for justice and dignity. https://t.co/giqmFblLUM",FALSE,1253,NA,2015-11-11 00:12:51,FALSE,NA,"664234295834341376",NA,"<a href=""http://twitter.com"" rel=""nofollow"">Twitter Web Client</a>","BernieSanders",578,FALSE,FALSE,NA,NA,2015,11
"Freedom of speech does not mean the freedom to buy the United States government.",FALSE,3061,NA,2015-11-10 23:49:04,FALSE,NA,"664228310331691009",NA,"<a href=""https://about.twitter.com/products/tweetdeck"" rel=""nofollow"">TweetDeck</a>","BernieSanders",1327,FALSE,FALSE,NA,NA,2015,11
"Bike canvassing is one way our organizers in NH help reduce the use of fossil fuels while reaching voters. #fitn https://t.co/lLOsrDq8Jl",FALSE,1603,NA,2015-11-10 22:36:43,FALSE,NA,"664210102841425920",NA,"<a href=""https://about.twitter.com/products/tweetdeck"" rel=""nofollow"">TweetDeck</a>","BernieSanders",459,FALSE,FALSE,NA,NA,2015,11
"Republicans' family values are that our gay brothers and sisters shouldn't be able to get married. I strongly disagree.",FALSE,4176,NA,2015-11-10 22:04:07,FALSE,NA,"664201897897668610",NA,"<a href=""https://about.twitter.com/products/tweetdeck"" rel=""nofollow"">TweetDeck</a>","BernieSanders",1553,FALSE,FALSE,NA,NA,2015,11
"Medicare for All would eliminate payments to insurance companies that put profits before people.",FALSE,1673,NA,2015-11-10 20:33:04,FALSE,NA,"664178983227928577",NA,"<a href=""https://about.twitter.com/products/tweetdeck"" rel=""nofollow"">TweetDeck</a>","BernieSanders",814,FALSE,FALSE,NA,NA,2015,11
"Only 18% of families headed by single moms have economic security. That is unacceptable.",FALSE,2377,NA,2015-11-10 19:02:03,FALSE,NA,"664156077714374656",NA,"<a href=""https://about.twitter.com/products/tweetdeck"" rel=""nofollow"">TweetDeck</a>","BernieSanders",1241,FALSE,FALSE,NA,NA,2015,11
"If the minimum wage had kept pace with productivity, it would be more than $16 per hour today.",FALSE,2832,NA,2015-11-10 17:04:04,FALSE,NA,"664126390271258624",NA,"<a href=""https://about.twitter.com/products/tweetdeck"" rel=""nofollow"">TweetDeck</a>","BernieSanders",1548,FALSE,FALSE,NA,NA,2015,11
"What workers all over the United States are doing is having a profound impact. This is your movement. #FightFor15
https://t.co/WmgZV9nj5d",FALSE,1395,NA,2015-11-10 16:03:25,FALSE,NA,"664111126771200000",NA,"<a href=""http://twitter.com"" rel=""nofollow"">Twitter Web Client</a>","BernieSanders",886,FALSE,FALSE,NA,NA,2015,11
"Proud to join striking workers today fighting for dignity and a living wage. #FightFor15 https://t.co/WIsjCAaNmg",FALSE,1898,NA,2015-11-10 15:37:33,FALSE,NA,"664104616561385472",NA,"<a href=""http://twitter.com/download/android"" rel=""nofollow"">Twitter for Android</a>","BernieSanders",1000,FALSE,FALSE,NA,NA,2015,11
"I don’t believe it is a terribly radical idea to say that someone who works 40 hours a week should not be living in poverty. #FightFor15",FALSE,6071,NA,2015-11-10 14:21:45,FALSE,NA,"664085541000888320",NA,"<a href=""https://about.twitter.com/products/tweetdeck"" rel=""nofollow"">TweetDeck</a>","BernieSanders",3577,FALSE,FALSE,NA,NA,2015,11
"I am prepared to take on powerful special interests which wield enormous power over the economic and political life of this country.",FALSE,1610,NA,2015-11-10 02:42:01,FALSE,NA,"663909448142876672",NA,"<a href=""https://about.twitter.com/products/tweetdeck"" rel=""nofollow"">TweetDeck</a>","BernieSanders",612,FALSE,FALSE,NA,NA,2015,11
"Our organizers in Manchester are working hard to build the political revolution this country needs. #nhpolitics https://t.co/NSgSUo50PX",FALSE,779,NA,2015-11-10 01:44:40,FALSE,NA,"663895014490120192",NA,"<a href=""http://twitter.com/download/iphone"" rel=""nofollow"">Twitter for iPhone</a>","BernieSanders",247,FALSE,FALSE,NA,NA,2015,11
"Too often our Native American brothers and sisters have seen corporate profits put ahead of their sovereign rights.",FALSE,2754,NA,2015-11-10 00:46:05,FALSE,NA,"663880269435310080",NA,"<a href=""https://about.twitter.com/products/tweetdeck"" rel=""nofollow"">TweetDeck</a>","BernieSanders",1279,FALSE,FALSE,NA,NA,2015,11
"We are the most powerful military in the world... but we must understand that war is the last resort, not the first.
https://t.co/T0IdCfqWOi",FALSE,2411,NA,2015-11-09 23:07:06,FALSE,NA,"663855360860532736",NA,"<a href=""http://twitter.com"" rel=""nofollow"">Twitter Web Client</a>","BernieSanders",1275,FALSE,FALSE,NA,NA,2015,11
"We are the most powerful military in the world... but we must understand that war is the last resort, not the first.
https://t.co/T0IdCfqWOi",FALSE,2411,NA,2015-11-09 23:07:06,FALSE,NA,"663855360860532736",NA,"<a href=""http://twitter.com"" rel=""nofollow"">Twitter Web Client</a>","BernieSanders",1275,FALSE,FALSE,NA,NA,2015,11
"Thank you to everyone who helped our campaign in Iowa this weekend. When we stand up and fight, we win. #FeelTheBern https://t.co/cx52gL58X3",FALSE,824,NA,2015-11-09 22:42:10,FALSE,NA,"663849087419211776",NA,"<a href=""http://twitter.com"" rel=""nofollow"">Twitter Web Client</a>","BernieSanders",288,FALSE,FALSE,NA,NA,2015,11
"I will direct my Administration to extend humane treatment and asylum to victims of domestic violence and unaccompanied minors.",FALSE,1456,NA,2015-11-09 19:22:58,FALSE,NA,"663798954765762560",NA,"<a href=""https://about.twitter.com/products/tweetdeck"" rel=""nofollow"">TweetDeck</a>","BernieSanders",482,FALSE,FALSE,NA,NA,2015,11
"I will direct immigration officers to immediately stop initiating deportations against those eligible for relief.",FALSE,1195,NA,2015-11-09 19:20:59,FALSE,NA,"663798455412891648",NA,"<a href=""https://about.twitter.com/products/tweetdeck"" rel=""nofollow"">TweetDeck</a>","BernieSanders",396,FALSE,FALSE,NA,NA,2015,11
"I will expand upon President Obama’s executive actions to provide broad Administrative relief to the parents of DREAMers.",FALSE,996,NA,2015-11-09 19:19:10,FALSE,NA,"663798001404649473",NA,"<a href=""https://about.twitter.com/products/tweetdeck"" rel=""nofollow"">TweetDeck</a>","BernieSanders",357,FALSE,FALSE,NA,NA,2015,11
"At a time when more than 60% of Americans don't vote, we must make it easier for people to vote, not harder. https://t.co/6M9EqJkj4D",FALSE,1848,NA,2015-11-09 18:23:50,FALSE,NA,"663784074742358016",NA,"<a href=""http://twitter.com"" rel=""nofollow"">Twitter Web Client</a>","BernieSanders",1158,FALSE,FALSE,NA,NA,2015,11
"We need to pass pay equity for women workers. Equal pay for equal work.",FALSE,2478,NA,2015-11-09 17:13:03,FALSE,NA,"663766262028197888",NA,"<a href=""https://about.twitter.com/products/tweetdeck"" rel=""nofollow"">TweetDeck</a>","BernieSanders",1380,FALSE,FALSE,NA,NA,2015,11
"The American people are sick and tired of having more wealth and income inequality than any other major developed country on Earth.",FALSE,2004,NA,2015-11-09 15:49:02,FALSE,NA,"663745117325365248",NA,"<a href=""https://about.twitter.com/products/tweetdeck"" rel=""nofollow"">TweetDeck</a>","BernieSanders",745,FALSE,FALSE,NA,NA,2015,11
"We should be investing in small businesses and worker-owned enterprises that want to create jobs in the United States of America.",FALSE,1522,NA,2015-11-09 14:32:01,FALSE,NA,"663725737711550464",NA,"<a href=""https://about.twitter.com/products/tweetdeck"" rel=""nofollow"">TweetDeck</a>","BernieSanders",626,FALSE,FALSE,NA,NA,2015,11
"Today’s undocumented workers play an important role in our economy. They are part of the fabric of America. https://t.co/eQMH4q1bBM",FALSE,1833,NA,2015-11-09 04:06:42,FALSE,NA,"663568370349039616",NA,"<a href=""https://about.twitter.com/products/tweetdeck"" rel=""nofollow"">TweetDeck</a>","BernieSanders",737,FALSE,FALSE,NA,NA,2015,11
"I will establish immigration policies that keep families together, not divide them. #BernieInVegas https://t.co/KfjiyXeeTA",FALSE,1877,NA,2015-11-09 03:54:47,FALSE,NA,"663565370956120064",NA,"<a href=""https://about.twitter.com/products/tweetdeck"" rel=""nofollow"">TweetDeck</a>","BernieSanders",841,FALSE,FALSE,NA,NA,2015,11
"Our great country and our gov’t belongs to all of us and not just a handful of billionaires. #BernieInVegas https://t.co/Q5I0hdO4bo",FALSE,1498,NA,2015-11-09 03:48:17,FALSE,NA,"663563733323616256",NA,"<a href=""https://about.twitter.com/products/tweetdeck"" rel=""nofollow"">TweetDeck</a>","BernieSanders",620,FALSE,FALSE,NA,NA,2015,11
"People in Nevada and in the rest of America are fighting and demanding a political revolution. #BernieInVegas",FALSE,1026,NA,2015-11-09 03:28:51,FALSE,NA,"663558845042696193",NA,"<a href=""https://about.twitter.com/products/tweetdeck"" rel=""nofollow"">TweetDeck</a>","BernieSanders",313,FALSE,FALSE,NA,NA,2015,11
"I am excited to be speaking at our rally in Las Vegas tonight! #BernieInVegas",FALSE,1222,NA,2015-11-09 02:20:22,FALSE,NA,"663541609854869504",NA,"<a href=""https://about.twitter.com/products/tweetdeck"" rel=""nofollow"">TweetDeck</a>","BernieSanders",282,FALSE,FALSE,NA,NA,2015,11
"Instead of giving tax breaks to billionaires we should be expanding nutrition programs and other services for seniors.",FALSE,1995,NA,2015-11-09 01:32:03,FALSE,NA,"663529450873733120",NA,"<a href=""https://about.twitter.com/products/tweetdeck"" rel=""nofollow"">TweetDeck</a>","BernieSanders",765,FALSE,FALSE,NA,NA,2015,11
"We can, and must, be a nation in which we do not have the highest rate of childhood poverty of any major developed country on earth.",FALSE,2022,NA,2015-11-08 23:16:46,FALSE,NA,"663495405125136384",NA,"<a href=""https://about.twitter.com/products/tweetdeck"" rel=""nofollow"">TweetDeck</a>","BernieSanders",951,FALSE,FALSE,NA,NA,2015,11
"American democracy is one person, one vote – with every citizen having an equal say – and no voter suppression. https://t.co/FAWnxSVBGY",FALSE,2561,NA,2015-11-08 20:37:53,FALSE,NA,"663455423282995200",NA,"<a href=""http://twitter.com/download/iphone"" rel=""nofollow"">Twitter for iPhone</a>","BernieSanders",1305,FALSE,FALSE,NA,NA,2015,11
"Workers in America today need decent pay raises, they need decent health care, and they need decent pensions.",FALSE,1652,NA,2015-11-08 19:04:32,FALSE,NA,"663431930994626560",NA,"<a href=""https://about.twitter.com/products/tweetdeck"" rel=""nofollow"">TweetDeck</a>","BernieSanders",706,FALSE,FALSE,NA,NA,2015,11
"This country and our government belong to all of us, not just a handful of very wealthy people.
#Bernie2016",FALSE,3038,NA,2015-11-08 16:47:03,FALSE,NA,"663397330842873856",NA,"<a href=""https://about.twitter.com/products/tweetdeck"" rel=""nofollow"">TweetDeck</a>","BernieSanders",1564,FALSE,FALSE,NA,NA,2015,11
"When you’re sick, you should be able to access health care. When you go to the hospital, you should not come out in bankruptcy.",FALSE,4340,NA,2015-11-08 15:14:32,FALSE,NA,"663374047640731648",NA,"<a href=""https://about.twitter.com/products/tweetdeck"" rel=""nofollow"">TweetDeck</a>","BernieSanders",2181,FALSE,FALSE,NA,NA,2015,11
"I’ll be on @ThisWeekABC this morning. Tune in! https://t.co/umH8eUGxdr",FALSE,1162,NA,2015-11-08 14:40:38,FALSE,NA,"663365514761256960",NA,"<a href=""https://about.twitter.com/products/tweetdeck"" rel=""nofollow"">TweetDeck</a>","BernieSanders",275,FALSE,FALSE,NA,NA,2015,11
"We have got to end this outrageous voter suppression which is taking place in dozens of states.
https://t.co/6poedxjaKg",FALSE,1146,NA,2015-11-08 02:45:07,FALSE,NA,"663185450668965890",NA,"<a href=""https://about.twitter.com/products/tweetdeck"" rel=""nofollow"">TweetDeck</a>","BernieSanders",503,FALSE,FALSE,NA,NA,2015,11
"Classifying marijuana in the same category as cocaine ignores the major issue.
https://t.co/mgmHtbXhtz",FALSE,1935,NA,2015-11-08 02:16:47,FALSE,NA,"663178318754111488",NA,"<a href=""https://about.twitter.com/products/tweetdeck"" rel=""nofollow"">TweetDeck</a>","BernieSanders",970,FALSE,FALSE,NA,NA,2015,11
"I am proud to have Latinos for Bernie representing our campaign in Iowa. #UnidosConBernie https://t.co/vZOrUDRRF3",FALSE,3002,NA,2015-11-08 01:22:53,FALSE,NA,"663164756040155141",NA,"<a href=""https://about.twitter.com/products/tweetdeck"" rel=""nofollow"">TweetDeck</a>","BernieSanders",1025,FALSE,FALSE,NA,NA,2015,11
"School teachers and educators are real American heroes.
#BernieInSC https://t.co/5tJqQHWlIk",FALSE,3367,NA,2015-11-08 00:47:55,FALSE,NA,"663155958030274560",NA,"<a href=""https://about.twitter.com/products/tweetdeck"" rel=""nofollow"">TweetDeck</a>","BernieSanders",1624,FALSE,FALSE,NA,NA,2015,11
"I am not just asking for your vote, I am asking for you to get involved in a political revolution. #BernieInSC",FALSE,3225,NA,2015-11-08 00:40:26,FALSE,NA,"663154072132849664",NA,"<a href=""https://about.twitter.com/products/tweetdeck"" rel=""nofollow"">TweetDeck</a>","BernieSanders",1429,FALSE,FALSE,NA,NA,2015,11
"The cost of war continues until the last veteran receives the care and benefits that he or she has earned on the battlefield.",FALSE,1811,NA,2015-11-08 00:20:04,FALSE,NA,"663148945728626688",NA,"<a href=""https://about.twitter.com/products/tweetdeck"" rel=""nofollow"">TweetDeck</a>","BernieSanders",816,FALSE,FALSE,NA,NA,2015,11
"There needs to be a path back from prison. We need real education and real skills training for the incarcerated.",FALSE,2456,NA,2015-11-07 22:26:03,FALSE,NA,"663120255351287808",NA,"<a href=""https://about.twitter.com/products/tweetdeck"" rel=""nofollow"">TweetDeck</a>","BernieSanders",996,FALSE,FALSE,NA,NA,2015,11
"We are going to get the government out of profiteering on student loans. That is going to change.",FALSE,2115,NA,2015-11-07 20:26:03,FALSE,NA,"663090053707501568",NA,"<a href=""https://about.twitter.com/products/tweetdeck"" rel=""nofollow"">TweetDeck</a>","BernieSanders",897,FALSE,FALSE,NA,NA,2015,11
"Shop for union-made items in the Bernie Store and help fund the political revolution!
https://t.co/HmmudAjDA9",FALSE,750,NA,2015-11-07 19:20:54,FALSE,NA,"663073658496139264",NA,"<a href=""https://about.twitter.com/products/tweetdeck"" rel=""nofollow"">TweetDeck</a>","BernieSanders",285,FALSE,FALSE,NA,NA,2015,11
"I’m proud to have the support of all of the volunteers at our Bernie Camp trainings across NH this weekend. When we organize, we win. #fitn",FALSE,889,NA,2015-11-07 18:42:20,FALSE,NA,"663063952729858048",NA,"<a href=""https://about.twitter.com/products/tweetdeck"" rel=""nofollow"">TweetDeck</a>","BernieSanders",235,FALSE,FALSE,NA,NA,2015,11
"Why do we accept a situation where thousands of qualified people are unable to go to college because their families don’t have enough money?",FALSE,4337,NA,2015-11-07 16:32:01,FALSE,NA,"663031159094276096",NA,"<a href=""https://about.twitter.com/products/tweetdeck"" rel=""nofollow"">TweetDeck</a>","BernieSanders",2404,FALSE,FALSE,NA,NA,2015,11
"We cannot and we should not even be talking about sweeping up millions of men, women, and children and throwing them out of the country.",FALSE,3790,NA,2015-11-07 14:27:02,FALSE,NA,"662999703924047872",NA,"<a href=""https://about.twitter.com/products/tweetdeck"" rel=""nofollow"">TweetDeck</a>","BernieSanders",1829,FALSE,FALSE,NA,NA,2015,11
"If the Republicans can't face a free election, they should get another job. #VotingRights
https://t.co/VSW5t7HQln",FALSE,5206,NA,2015-11-07 03:18:04,FALSE,NA,"662831353872846853",NA,"<a href=""http://twitter.com"" rel=""nofollow"">Twitter Web Client</a>","BernieSanders",3322,FALSE,FALSE,NA,NA,2015,11
"Our campaign has the excitement and the energy to win in the South and all over this country. #DemForum",FALSE,1698,NA,2015-11-07 02:06:06,FALSE,NA,"662813244134936576",NA,"<a href=""http://twitter.com"" rel=""nofollow"">Twitter Web Client</a>","BernieSanders",598,FALSE,FALSE,NA,NA,2015,11
"""People who suppress the vote are political cowards and are undermining democracy."" #DemForum",FALSE,2371,NA,2015-11-07 02:03:46,FALSE,NA,"662812657460842496",NA,"<a href=""http://twitter.com"" rel=""nofollow"">Twitter Web Client</a>","BernieSanders",1343,FALSE,FALSE,NA,NA,2015,11
"""Back in 1988, I said it is wrong in this country for people to be buying assault weapons designed just to kill human beings."" #DemForum",FALSE,1764,NA,2015-11-07 02:01:45,FALSE,NA,"662812149920698368",NA,"<a href=""http://twitter.com"" rel=""nofollow"">Twitter Web Client</a>","BernieSanders",604,FALSE,FALSE,NA,NA,2015,11
"Dream job: President of CNN.",FALSE,2854,NA,2015-11-07 01:52:48,FALSE,NA,"662809895230693376",NA,"<a href=""http://twitter.com"" rel=""nofollow"">Twitter Web Client</a>","BernieSanders",783,FALSE,FALSE,NA,NA,2015,11
"""I would not have run for president if I believed that establishment politics and economics could solve the problems we face."" #DemForum",FALSE,1848,NA,2015-11-07 01:51:58,FALSE,NA,"662809689248370688",NA,"<a href=""http://twitter.com"" rel=""nofollow"">Twitter Web Client</a>","BernieSanders",851,FALSE,FALSE,NA,NA,2015,11
"""I said no to Keystone on day one."" #DemForum",FALSE,1431,NA,2015-11-07 01:46:02,FALSE,NA,"662808192011911168",NA,"<a href=""http://twitter.com"" rel=""nofollow"">Twitter Web Client</a>","BernieSanders",472,FALSE,FALSE,NA,NA,2015,11
"Our agenda invests $1 trillion into building roads, bridges and infrastructure to create or maintain 13 million jobs. #DemForum",FALSE,1076,NA,2015-11-07 01:45:27,FALSE,NA,"662808047983685636",NA,"<a href=""http://twitter.com"" rel=""nofollow"">Twitter Web Client</a>","BernieSanders",459,FALSE,FALSE,NA,NA,2015,11
"We are going to invest in jobs and education for the kids of this country, rather than jails and incarceration. #DemForum",FALSE,1617,NA,2015-11-07 01:43:14,FALSE,NA,"662807490074189824",NA,"<a href=""http://twitter.com"" rel=""nofollow"">Twitter Web Client</a>","BernieSanders",852,FALSE,FALSE,NA,NA,2015,11
"We're up next at the #DemForum here in South Carolina. Watch live: https://t.co/AQQHWMQxgy",FALSE,485,NA,2015-11-07 01:33:19,FALSE,NA,"662804995864174592",NA,"<a href=""http://twitter.com"" rel=""nofollow"">Twitter Web Client</a>","BernieSanders",230,FALSE,FALSE,NA,NA,2015,11
"The Keystone pipeline victory is about millions of people demanding real change. That's what our campaign is about too. #MSNBC2016",FALSE,1220,NA,2015-11-07 01:09:59,FALSE,NA,"662799123079438339",NA,"<a href=""http://twitter.com"" rel=""nofollow"">Twitter Web Client</a>","BernieSanders",433,FALSE,FALSE,NA,NA,2015,11
"Will the Republicans tell us why they reject the near-unanimous scientific opinion that climate change is real and caused by human activity?",FALSE,2856,NA,2015-11-07 00:02:03,FALSE,NA,"662782024902553600",NA,"<a href=""https://about.twitter.com/products/tweetdeck"" rel=""nofollow"">TweetDeck</a>","BernieSanders",1308,FALSE,FALSE,NA,NA,2015,11
"Make any donation to our campaign and I'll send you a copy of my book ""Outsider in the White House."" https://t.co/tuIgkt7TJk",FALSE,866,NA,2015-11-06 22:46:02,FALSE,NA,"662762895088873472",NA,"<a href=""https://about.twitter.com/products/tweetdeck"" rel=""nofollow"">TweetDeck</a>","BernieSanders",377,FALSE,FALSE,NA,NA,2015,11
"Anybody who is suppressing the vote, who is intentionally trying to keep people from voting is a political coward.
https://t.co/U3bphCkWVS",FALSE,1539,NA,2015-11-06 21:35:12,FALSE,NA,"662745070186029057",NA,"<a href=""https://about.twitter.com/products/tweetdeck"" rel=""nofollow"">TweetDeck</a>","BernieSanders",831,FALSE,FALSE,NA,NA,2015,11
"The #KeystoneXL rejection is a triumph for a grassroots movement that demanded the necessary &amp; refused to give in. When we organize, we win.",FALSE,2296,NA,2015-11-06 20:24:04,FALSE,NA,"662727169785786369",NA,"<a href=""https://about.twitter.com/products/tweetdeck"" rel=""nofollow"">TweetDeck</a>","BernieSanders",1023,FALSE,FALSE,NA,NA,2015,11
